{
  "$schema": "https://chartmux.dev/schema/v1.json",
  "version": 1,
  "type": "area",
  "title": "Visitors",
  "description": "January – June 2024",
  "xAxis": {
    "dataKey": "month",
    "kind": "category"
  },
  "series": [
    {
      "dataKey": "desktop",
      "label": "Desktop",
      "color": "var(--chart-1)"
    },
    {
      "dataKey": "mobile",
      "label": "Mobile",
      "color": "var(--chart-2)"
    }
  ],
  "layout": "stacked",
  "curve": "smooth",
  "legend": {
    "show": true
  },
  "axes": {
    "show": true
  },
  "data": [
    { "month": "January", "desktop": 186, "mobile": 80 },
    { "month": "February", "desktop": 305, "mobile": 200 },
    { "month": "March", "desktop": 237, "mobile": 120 },
    { "month": "April", "desktop": 73, "mobile": 190 },
    { "month": "May", "desktop": 209, "mobile": 130 },
    { "month": "June", "desktop": 214, "mobile": 140 }
  ]
}
